name,price,No_of_rating,rating,description,category
"Unity Brand 3 Meter Multipurpose Double Sided Tape Heavy Duty - Adhesive Silicone Tape, Heat Resistant, Multi-Functional, Removable, Washable, Reusable Anti-Slip Gel Nano Grip Tape (1 PACK)",₹239.00,146,N/A,"Unity Brand 3 Meter Multipurpose Double Sided Tape Heavy Duty - Adhesive Silicone Tape, Heat Resistant, Multi-Functional, Removable, Washable, Reusable Anti-Slip Gel Nano Grip Tape (1 PACK)",Office
"Kadam Fabric Dye Multicolour Combo (C1: Vivid- Lemon Yellow, Orange, Red, Violet, Blue, Sky Blue, Brown, Parrot Green, Baby Pink, Teal Green)",₹299.00,"2,214",N/A,"Kadam Fabric Dye Multicolour Combo (C1: Vivid- Lemon Yellow, Orange, Red, Violet, Blue, Sky Blue, Brown, Parrot Green, Baby Pink, Teal Green)",Office
"Scotch 3M Scotch Scissors | 6"" Multipurpose | Comfort Grip Handle And Stainless Steel Blades | Paper, Photos, Crafts",₹224.00,"5,787",N/A,"Scotch 3M Scotch Scissors | 6"" Multipurpose | Comfort Grip Handle And Stainless Steel Blades | Paper, Photos, Crafts",Office
"Eclet Nano Double Sided Tape, Multipurpose Super Sticky Gel Grip Mounting Tape, Washable, Reusable, No Residue, for Home & Office, 2mm Thick, 1.2 Inch Wide, Transparent (3 mtrs)",₹115.00,550,N/A,"Eclet Nano Double Sided Tape, Multipurpose Super Sticky Gel Grip Mounting Tape, Washable, Reusable, No Residue, for Home & Office, 2mm Thick, 1.2 Inch Wide, Transparent (3 mtrs)",Office
"Grandink Portable Lightweight Tripod Easel for Professional Artists, Metal Display Easel Stand with Adjustable Height for Painting, Display and Advertisement Purposes - 5FT(Holds Canvas up to 1 kg)",₹599.00,"1,279",N/A,"Grandink Portable Lightweight Tripod Easel for Professional Artists, Metal Display Easel Stand with Adjustable Height for Painting, Display and Advertisement Purposes - 5FT(Holds Canvas up to 1 kg)",Office
"Amazon Basics - Cable Management Box with Mobile Stand - Power Strip, Cords, Wires | Surge Protector Hiding Cover Organizer for Home, Office (White)",₹399.00,293,N/A,"Amazon Basics - Cable Management Box with Mobile Stand - Power Strip, Cords, Wires | Surge Protector Hiding Cover Organizer for Home, Office (White)",Office
"LAURET BLANC Notebook Journal - A5 Size, 144 Ruled Pages, 90 GSM Natural Shade, Paperback",₹189.00,"1,847",N/A,"LAURET BLANC Notebook Journal - A5 Size, 144 Ruled Pages, 90 GSM Natural Shade, Paperback",Office
"Casio FX-82MS 2nd Gen Non-Programmable Scientific Calculator, 240 Functions and 2-line Display",₹599.00,"11,339",N/A,"Casio FX-82MS 2nd Gen Non-Programmable Scientific Calculator, 240 Functions and 2-line Display",Office
Pentonic 0.6 mm-1.0 mm Gel Pen Blister Pack With Hard Box Case | Black Body | Multicolor Ink | Set of 10 Pens,₹150.00,"6,165",N/A,Pentonic 0.6 mm-1.0 mm Gel Pen Blister Pack With Hard Box Case | Black Body | Multicolor Ink | Set of 10 Pens,Office
Classmate Pulse Single Subject Spiral Notebook - Pack of 4 | Unruled | 200 Pages | 24.0cm x 18.0cm | Attractive Cover Designs | Soft Cover |Notebooks for College Students,₹294.00,"1,475",N/A,Classmate Pulse Single Subject Spiral Notebook - Pack of 4 | Unruled | 200 Pages | 24.0cm x 18.0cm | Attractive Cover Designs | Soft Cover |Notebooks for College Students,Office
"SNDIA 50 Pcs Key Tag Multicolor Keyring & Keychain With Name Tag Labels Assorted Keychain With Two Side Id Label And Split Ring For Office, Home Key -Plastic",₹199.00,"7,821",N/A,"SNDIA 50 Pcs Key Tag Multicolor Keyring & Keychain With Name Tag Labels Assorted Keychain With Two Side Id Label And Split Ring For Office, Home Key -Plastic",Office
COI Note Pad/Memo Book with Sticky Notes & Clip Holder with Pen for Gifting,₹199.00,"12,493",N/A,COI Note Pad/Memo Book with Sticky Notes & Clip Holder with Pen for Gifting,Office
Cello Finegrip Ball Pen | Blue Ball Pens | Jar of 25 Units | Best Ball Pens for Smooth Writing | Ball Point Pen Set | Pens for Students and Professionals Stationery,₹142.00,"22,017",N/A,Cello Finegrip Ball Pen | Blue Ball Pens | Jar of 25 Units | Best Ball Pens for Smooth Writing | Ball Point Pen Set | Pens for Students and Professionals Stationery,Office
"BRUSTRO White Gel Pen | Tip size -1 mm|Pack of 3 | Ideal for Students and Adults, Drawing, Mandala Arts, Students, Office Use, Writing, Pen Set",₹143.00,"1,059",N/A,"BRUSTRO White Gel Pen | Tip size -1 mm|Pack of 3 | Ideal for Students and Adults, Drawing, Mandala Arts, Students, Office Use, Writing, Pen Set",Office
Flair Hauser XO Multicolor Gel Pen with Hard Box Case | Sleek Body & Minimalistic Design | Matt Finish | Ultra Durable Tip | Set Of 12 Bright Ink Colors,₹150.00,769,N/A,Flair Hauser XO Multicolor Gel Pen with Hard Box Case | Sleek Body & Minimalistic Design | Matt Finish | Ultra Durable Tip | Set Of 12 Bright Ink Colors,Office
"Birch & Co. Gift Wrapping Paper Sheet - Gift Paper - Gift Wrap Roll -Gift Cover Rapping Paper - Gift Packing Materials - Premium Design Paper sheet for Gift Packing, Mix, Pack of 6, Multicolor",₹251.00,"1,079",N/A,"Birch & Co. Gift Wrapping Paper Sheet - Gift Paper - Gift Wrap Roll -Gift Cover Rapping Paper - Gift Packing Materials - Premium Design Paper sheet for Gift Packing, Mix, Pack of 6, Multicolor",Office
"Hauser XO 0.7mm Ball Pen Tumbler | Sleek Body & Minimalistic Design | Matt Finish & Solid Body Type | Low Viscosity Ink with Ultra Durable Tip | Blue, Black & Red Ink, Pack of 50 Pens",₹399.00,"7,229",N/A,"Hauser XO 0.7mm Ball Pen Tumbler | Sleek Body & Minimalistic Design | Matt Finish & Solid Body Type | Low Viscosity Ink with Ultra Durable Tip | Blue, Black & Red Ink, Pack of 50 Pens",Office
"Cetaphil Face Wash Gentle Skin Cleanser for Dry to Normal, Sensitive Skin, 125 ml Hydrating Face Wash with Niacinamide, Vitamin B5",₹359.00,"2,468",N/A,"Cetaphil Face Wash Gentle Skin Cleanser for Dry to Normal, Sensitive Skin, 125 ml Hydrating Face Wash with Niacinamide, Vitamin B5",Beauty
"The Derma Co 1% Hyaluronic Sunscreen SPF 50 Aqua Gel, PA++++, Lightweight, No white-cast for Broad Spectrum & Blue Light Protection for Oily, Dry, Acne-prone Skin - 30g",₹268.00,"23,605",N/A,"The Derma Co 1% Hyaluronic Sunscreen SPF 50 Aqua Gel, PA++++, Lightweight, No white-cast for Broad Spectrum & Blue Light Protection for Oily, Dry, Acne-prone Skin - 30g",Beauty
"Dettol Original Germ Protection Bathing Soap Bar (400gm) | Kills 99.99% germs, 100g - Pack of 4",₹130.00,"21,479",N/A,"Dettol Original Germ Protection Bathing Soap Bar (400gm) | Kills 99.99% germs, 100g - Pack of 4",Beauty
"L'Oreal Paris Moisture Sealing Conditioner, With Hyaluronic Acid, For Dry & Dehydrated Hair, Adds Hydration, Shine & Bounce, Hyaluron Moisture 72H, 180ml",₹242.00,"1,335",N/A,"L'Oreal Paris Moisture Sealing Conditioner, With Hyaluronic Acid, For Dry & Dehydrated Hair, Adds Hydration, Shine & Bounce, Hyaluron Moisture 72H, 180ml",Beauty
"L'Oreal Paris Serum, Protection and Shine, For Dry, Flyaway & Frizzy Hair, With 6 Rare Flower Oils, Extraordinary Oil, 100ml",₹389.00,"10,860",N/A,"L'Oreal Paris Serum, Protection and Shine, For Dry, Flyaway & Frizzy Hair, With 6 Rare Flower Oils, Extraordinary Oil, 100ml",Beauty
"Khadi Natural Amla & Bhringraj Shampoo/Cleanser for Controlling Dandruff & Hair fall | Shampoo for Reducing Scalp Irritation | Paraben & Sulphate-Free | Suitable for All Hair Types, 210ml",₹139.00,"33,930",N/A,"Khadi Natural Amla & Bhringraj Shampoo/Cleanser for Controlling Dandruff & Hair fall | Shampoo for Reducing Scalp Irritation | Paraben & Sulphate-Free | Suitable for All Hair Types, 210ml",Beauty
"L'Oreal Paris Moisture Filling Shampoo With Hyaluronic Acid | For Dry & Dehydrated Hair, Adds Shine & Bounce, Hyaluron Moisture 72H, 340ml | L'Oreal Paris",₹257.00,"33,507",N/A,"L'Oreal Paris Moisture Filling Shampoo With Hyaluronic Acid | For Dry & Dehydrated Hair, Adds Shine & Bounce, Hyaluron Moisture 72H, 340ml | L'Oreal Paris",Beauty
Dettol Liquid Handwash Refill - Original Hand Wash- 1350ml | Germ Defence Formula | 10x Better Germ Protection,₹182.00,"8,496",N/A,Dettol Liquid Handwash Refill - Original Hand Wash- 1350ml | Germ Defence Formula | 10x Better Germ Protection,Beauty
"Simple Kind To Skin Refreshing Face Wash 150 ml | 100% soap-free gentle cleanser for sensitive, dry & oily skin, for women & men",₹340.00,"81,765",N/A,"Simple Kind To Skin Refreshing Face Wash 150 ml | 100% soap-free gentle cleanser for sensitive, dry & oily skin, for women & men",Beauty
NIVEA Nourishing Body Milk 600ml Body Lotion | 48 H Moisturization | With 2X Almond Oil | Smooth and Healthy Looking Skin |For Very Dry Skin,₹405.42,"19,820",N/A,NIVEA Nourishing Body Milk 600ml Body Lotion | 48 H Moisturization | With 2X Almond Oil | Smooth and Healthy Looking Skin |For Very Dry Skin,Beauty
Alps Goodness Rosemary Water Spray For Hair Growth (200 ml) | Hair Spray for Regrowth | Rosemary Hair Mist | Adds Shine | Helps Reduce Hairfall | Strengthens Hair | Suitable For All Hair Types,₹285.00,"51,360",N/A,Alps Goodness Rosemary Water Spray For Hair Growth (200 ml) | Hair Spray for Regrowth | Rosemary Hair Mist | Adds Shine | Helps Reduce Hairfall | Strengthens Hair | Suitable For All Hair Types,Beauty
"WishCare Hair Growth Serum Concentrate - Rosemary, 3% Redensyl, 4% Anagain, 2% Baicapil, Caffeine, Biotin, Plant Keratin & Rice Water - Hair Growth Serum for Men & Women",₹681.00,"1,424",N/A,"WishCare Hair Growth Serum Concentrate - Rosemary, 3% Redensyl, 4% Anagain, 2% Baicapil, Caffeine, Biotin, Plant Keratin & Rice Water - Hair Growth Serum for Men & Women",Beauty
"NIVEA Soft Light Moisturizer, 300 ml, for Face, Hand & Body, Non-Greasy Cream with Vitamin E & Jojoba Oil for Instant Hydration",₹319.00,"6,082",N/A,"NIVEA Soft Light Moisturizer, 300 ml, for Face, Hand & Body, Non-Greasy Cream with Vitamin E & Jojoba Oil for Instant Hydration",Beauty
"Deconstruct Face Gel Sunscreen Spf 55+ And Pa+++ |For Oily Skin, Combination Skin, Normal Skin | Broad Spectrum Sunscreen, No White Cast, Lightweight, Non Greasy",₹321.00,"61,789",N/A,"Deconstruct Face Gel Sunscreen Spf 55+ And Pa+++ |For Oily Skin, Combination Skin, Normal Skin | Broad Spectrum Sunscreen, No White Cast, Lightweight, Non Greasy",Beauty
"Maybelline New York Colossal Kajal, Intense Colour, Waterproof, Long lasting 24Hrs Stay, Black, 0.35g",₹109.00,"2,581",N/A,"Maybelline New York Colossal Kajal, Intense Colour, Waterproof, Long lasting 24Hrs Stay, Black, 0.35g",Beauty
"Minimalist 2% Salicylic Acid Face Wash For Oily Skin | Sulphate free, Anti Acne Face Cleanser With LHA & Zinc For Acne or Pimples | For Women & Men | 100 ml",₹284.00,"34,644",N/A,"Minimalist 2% Salicylic Acid Face Wash For Oily Skin | Sulphate free, Anti Acne Face Cleanser With LHA & Zinc For Acne or Pimples | For Women & Men | 100 ml",Beauty
"Pears Pure & Gentle Soap Bar (Buy 4 get 1 free) - With Glycerin for Soft, Glowing Skin & Body, Paraben-Free Body Soaps For Bath",₹372.00,"16,057",N/A,"Pears Pure & Gentle Soap Bar (Buy 4 get 1 free) - With Glycerin for Soft, Glowing Skin & Body, Paraben-Free Body Soaps For Bath",Beauty
"Chemist At Play Exfoliating Body Wash 236ml | 4% (Salicylic Acid, Vitamin E and Lactic Acid) | Paraben & SLS Free | Gentle Exfoliating Shower Gel | Removes Tan| Prevents Dry, Rough, Bumpy Skin | Men & Women",₹369.00,"50,966",N/A,"Chemist At Play Exfoliating Body Wash 236ml | 4% (Salicylic Acid, Vitamin E and Lactic Acid) | Paraben & SLS Free | Gentle Exfoliating Shower Gel | Removes Tan| Prevents Dry, Rough, Bumpy Skin | Men & Women",Beauty
"Scalpe Pro Daily Anti-Dandruff Shampoo | Removes Dandruff From Source | Helps With Itching, Irritation & Redness Accompanying Dandruff | Climbazole & Zpto Formulation | For Women & Men | 100Ml",₹179.00,"3,714",N/A,"Scalpe Pro Daily Anti-Dandruff Shampoo | Removes Dandruff From Source | Helps With Itching, Irritation & Redness Accompanying Dandruff | Climbazole & Zpto Formulation | For Women & Men | 100Ml",Beauty
POND'S Super Light Gel Oil Free Face Moisturizer 100 ml | With Hyaluronic Acid & Vitamin E for Fresh Glowing Skin & 24 hr Hydration - Daily Use,₹221.00,"19,723",N/A,POND'S Super Light Gel Oil Free Face Moisturizer 100 ml | With Hyaluronic Acid & Vitamin E for Fresh Glowing Skin & 24 hr Hydration - Daily Use,Beauty
"RENEE Midnight Kohl Pencil - Smudgeproof and Waterproof Kajal - 24 Hrs Long Stay - Darkest Black - One Swipe Application - Rich Color Payoff - Vitamin E, Olive Oil and Castor Oil - 1.5 Gm",₹369.00,"5,446",N/A,"RENEE Midnight Kohl Pencil - Smudgeproof and Waterproof Kajal - 24 Hrs Long Stay - Darkest Black - One Swipe Application - Rich Color Payoff - Vitamin E, Olive Oil and Castor Oil - 1.5 Gm",Beauty
"Bella Vita Luxury Woman Eau De Parfum Gift Set 4x20 ml for Women with Date, Senorita, Glam, Rose Perfume|Floral, Fruity Long Lasting EDP Fragrance Scent",₹499.00,"3,361",N/A,"Bella Vita Luxury Woman Eau De Parfum Gift Set 4x20 ml for Women with Date, Senorita, Glam, Rose Perfume|Floral, Fruity Long Lasting EDP Fragrance Scent",Beauty
"Mysore Sandal Soap,450g (150x3) (Pack Of 3)",₹220.00,"19,122",N/A,"Mysore Sandal Soap,450g (150x3) (Pack Of 3)",Beauty
"Garnier Skin Naturals, Face Serum, Increases Skin's Glow Instantly and Reduces Spots Overtime, Bright Complete Vitamin C Booster, 30 ml",₹389.00,"31,689",N/A,"Garnier Skin Naturals, Face Serum, Increases Skin's Glow Instantly and Reduces Spots Overtime, Bright Complete Vitamin C Booster, 30 ml",Beauty
NIVEA MEN Fresh Active 50ml Deo Roll On | With Fresh Ocean Extracts| 48 H Freshness| 0% Alcohol | Dermatalogically Approved & Paraben Free Formula,₹150.50,"34,790",N/A,NIVEA MEN Fresh Active 50ml Deo Roll On | With Fresh Ocean Extracts| 48 H Freshness| 0% Alcohol | Dermatalogically Approved & Paraben Free Formula,Beauty
"Muuchstac Ocean Face Wash for Men | Fight Acne & Pimples, Brighten Skin, Clears Dirt, Oil Control, Refreshing Feel - Multi-Action Formula (2x100 ml)",₹299.00,"62,770",N/A,"Muuchstac Ocean Face Wash for Men | Fight Acne & Pimples, Brighten Skin, Clears Dirt, Oil Control, Refreshing Feel - Multi-Action Formula (2x100 ml)",Beauty
Dettol Liquid Handwash Refill – Skincare Hand Wash- 1350ml | pH Balanced | 10x Better Germ Protection,₹182.00,"10,343",N/A,Dettol Liquid Handwash Refill – Skincare Hand Wash- 1350ml | pH Balanced | 10x Better Germ Protection,Beauty
"Cetaphil Oily Skin Cleanser , Daily Face Wash For Oily, Acne Prone Skin , Gentle Foaming, 125Ml",₹584.00,"49,019",N/A,"Cetaphil Oily Skin Cleanser , Daily Face Wash For Oily, Acne Prone Skin , Gentle Foaming, 125Ml",Beauty
"Bella Vita Luxury Man Perfume Gift Set 4 x 20 ml for Men with KLUB, OUD, CEO, G.O.A.T Perfume | Woody, Citrusy Long Lasting EDP Fragrance Scent",₹499.00,"11,238",N/A,"Bella Vita Luxury Man Perfume Gift Set 4 x 20 ml for Men with KLUB, OUD, CEO, G.O.A.T Perfume | Woody, Citrusy Long Lasting EDP Fragrance Scent",Beauty
Dulhan Hum Le Jayenge 2000 [Audio CD] Music Himesh Reshammiya,₹190.00,7,,Dulhan Hum Le Jayenge 2000 [Audio CD] Music Himesh Reshammiya,Music
"DesiDiya® 35 Feet Long LED Power Pixel Serial String Light, 360 Degree Light in Bulb | Copper Led Pixel String Light for Home Decoration,Diwali,Christmas(Warm White) Pack of 1",₹99.00,"15,864",,"DesiDiya® 35 Feet Long LED Power Pixel Serial String Light, 360 Degree Light in Bulb | Copper Led Pixel String Light for Home Decoration,Diwali,Christmas(Warm White) Pack of 1",Kitchen
"Amazon Brand - Presto! Garbage Bags Medium 180 Count|19 x 21 inches Black , For Dry & Wet waste|30 bags/roll (Pack of 6)",₹335.00,"48,090",N/A,"Amazon Brand - Presto! Garbage Bags Medium 180 Count|19 x 21 inches Black , For Dry & Wet waste|30 bags/roll (Pack of 6)",Kitchen
"Zulaxy Photo Frame Hooks for Wall Without Drilling, 10 Pack Self Adhesive Hooks for Wall Heavy Duty Strong Nail Free for Hanging Photo Frame (Hanging Hook, Transparent) Stainless Steel",₹274.00,"7,992",N/A,"Zulaxy Photo Frame Hooks for Wall Without Drilling, 10 Pack Self Adhesive Hooks for Wall Heavy Duty Strong Nail Free for Hanging Photo Frame (Hanging Hook, Transparent) Stainless Steel",Kitchen
"Lexton 36 Feet Long 40 LED Power Pixel Serial String/Fairy Light | Plug Sourced | Suitable for Home & Outdoor Decoration, Diwali, Christmas, Ramadan, Wedding, Party, Festival (Pack of 1 Warm White)",₹99.00,"13,657",N/A,"Lexton 36 Feet Long 40 LED Power Pixel Serial String/Fairy Light | Plug Sourced | Suitable for Home & Outdoor Decoration, Diwali, Christmas, Ramadan, Wedding, Party, Festival (Pack of 1 Warm White)",Kitchen
"Amazon Brand - Solimo Wax Tealight Candles, 3-Hour Burn Time, Smokeless, No Residue (Set of 100, Unscented)",₹379.00,"76,686",N/A,"Amazon Brand - Solimo Wax Tealight Candles, 3-Hour Burn Time, Smokeless, No Residue (Set of 100, Unscented)",Kitchen
"nutripro Copper Juicer Mixer Grinder - Smoothie Maker - 500 Watts (3 Jars, Silver) - 2 Year Warranty","₹1,649.00","14,658",N/A,"nutripro Copper Juicer Mixer Grinder - Smoothie Maker - 500 Watts (3 Jars, Silver) - 2 Year Warranty",Kitchen
Ezee Black Garbage Bags for Dustbin | 90 Pcs | Medium 19 X 21 Inches | 30 Pcs x Pack of 3,₹159.00,"34,487",N/A,Ezee Black Garbage Bags for Dustbin | 90 Pcs | Medium 19 X 21 Inches | 30 Pcs x Pack of 3,Kitchen
"Pigeon by Stovekraft Amaze Plus Electric Kettle (14289) with Stainless Steel Body, 1.5 litre, used for boiling Water, making tea and coffee, instant noodles, soup etc. (Silver)",₹549.00,"168,402",N/A,"Pigeon by Stovekraft Amaze Plus Electric Kettle (14289) with Stainless Steel Body, 1.5 litre, used for boiling Water, making tea and coffee, instant noodles, soup etc. (Silver)",Kitchen
"HomeStrap Set Of 6 Non-Woven Printed Saree Cover/Cloth Storage/Wardrobe Organizer For Clothes With Transparent Window(Grey)(Shark Tank Featured),45 Cm,22 Cm",₹449.00,"14,593",N/A,"HomeStrap Set Of 6 Non-Woven Printed Saree Cover/Cloth Storage/Wardrobe Organizer For Clothes With Transparent Window(Grey)(Shark Tank Featured),45 Cm,22 Cm",Kitchen
Godrej aer Matic Kit (Machine + 1 Refill) - Automatic Room Fresheners with Flexi Control Spray | Violet Valley Bloom | 2200 Sprays Guaranteed | Lasts up to 60 days (225ml),₹419.00,"23,429",N/A,Godrej aer Matic Kit (Machine + 1 Refill) - Automatic Room Fresheners with Flexi Control Spray | Violet Valley Bloom | 2200 Sprays Guaranteed | Lasts up to 60 days (225ml),Kitchen
"Status Contract Anti Slip Front Door Mat|(38x58cm) Living Room Rug for Entrance Door|Polypropylene Floor Mats for Home|Essential Small Rug for Office, Bedroom & Kitchen| (Blue), Rectangular",₹99.00,"26,056",N/A,"Status Contract Anti Slip Front Door Mat|(38x58cm) Living Room Rug for Entrance Door|Polypropylene Floor Mats for Home|Essential Small Rug for Office, Bedroom & Kitchen| (Blue), Rectangular",Kitchen
"Misamo Enterprise PVC Wall Hooks, Pack of 15, Transparent",₹189.00,"6,758",N/A,"Misamo Enterprise PVC Wall Hooks, Pack of 15, Transparent",Kitchen
JIALTO Adhesive Wall Hook 10 Pack Heavy Duty Wall Hooks for Hanging Wall Decor Items Home Decor Items Wall Clock Hanging Hooks Photo Frame Hooks for Wall Without Drilling Nail Hook Key Holder,₹229.00,"10,557",N/A,JIALTO Adhesive Wall Hook 10 Pack Heavy Duty Wall Hooks for Hanging Wall Decor Items Home Decor Items Wall Clock Hanging Hooks Photo Frame Hooks for Wall Without Drilling Nail Hook Key Holder,Kitchen
"Wakefit 100% Waterproof Premium Cotton Mattress Protector | Breathable and Hypoallergenic Ultra Soft Fitted Bed Protector 78""x72"" - King, Grey","₹1,049.00","104,127",N/A,"Wakefit 100% Waterproof Premium Cotton Mattress Protector | Breathable and Hypoallergenic Ultra Soft Fitted Bed Protector 78""x72"" - King, Grey",Kitchen
"ATOM Digital Kitchen Food Weighing Scale For Healthy Living, Home Baking, Cooking, Fitness & Balanced Diet. | 1 Year Warranty | 10Kg x 1gms with 2 Batteries Included, SF400/A121, Color May vary",₹235.00,"6,271",N/A,"ATOM Digital Kitchen Food Weighing Scale For Healthy Living, Home Baking, Cooking, Fitness & Balanced Diet. | 1 Year Warranty | 10Kg x 1gms with 2 Batteries Included, SF400/A121, Color May vary",Kitchen
"Recron Certified Dream Fibre Pillow (41X61, Fiber;Microfiber, White, Pack Of 2)",₹379.00,"47,874",N/A,"Recron Certified Dream Fibre Pillow (41X61, Fiber;Microfiber, White, Pack Of 2)",Kitchen
"Amazon Brand - Presto! Garbage Bags Large 90 Count|24 x 32 Inches Black , For Dry & Wet waste|15 bags/roll (Pack of 6)",₹345.00,"13,841",N/A,"Amazon Brand - Presto! Garbage Bags Large 90 Count|24 x 32 Inches Black , For Dry & Wet waste|15 bags/roll (Pack of 6)",Kitchen
Shalimar Premium Garbage Bags ( Lavender Fragrance ) Size 19 X 21 Inches (Medium) 120 Bags (4 Rolls) Dustbin Bag/Trash Bag - Black Color,₹299.00,"20,852",N/A,Shalimar Premium Garbage Bags ( Lavender Fragrance ) Size 19 X 21 Inches (Medium) 120 Bags (4 Rolls) Dustbin Bag/Trash Bag - Black Color,Kitchen
"BSB HOME® 200 TC 100% Cotton Feel Bedsheet for Double Bed with Two King Size Pillow Covers Soft/Breathable Wrinkel Free - 90x100 Inches - (Multicolour, Light Pink)",₹199.00,"1,273",N/A,"BSB HOME® 200 TC 100% Cotton Feel Bedsheet for Double Bed with Two King Size Pillow Covers Soft/Breathable Wrinkel Free - 90x100 Inches - (Multicolour, Light Pink)",Kitchen
"Crompton Arno Neo 10-L 5 Star Rated Storage Water Heater (Geyser) with Advanced 3 Level Safety, National Energy Conservation Award Winner 2023","₹4,999.00","24,326",N/A,"Crompton Arno Neo 10-L 5 Star Rated Storage Water Heater (Geyser) with Advanced 3 Level Safety, National Energy Conservation Award Winner 2023",Kitchen
"Pigeon by Stovekraft Favourite Outer Lid Non Induction Aluminium Pressure Cooker, 3 Litres, Silver",₹699.00,"87,141",N/A,"Pigeon by Stovekraft Favourite Outer Lid Non Induction Aluminium Pressure Cooker, 3 Litres, Silver",Kitchen
"Trance 100% Waterproof Premium Cotton Feel Mattress Protector King Size 78x72 Inches | Breathable and Hypoallergenic Ultra Soft Fitted Bed Protector Cover (78""x72"" Fits Upto 10 Inches - King, Grey",₹669.00,"28,868",N/A,"Trance 100% Waterproof Premium Cotton Feel Mattress Protector King Size 78x72 Inches | Breathable and Hypoallergenic Ultra Soft Fitted Bed Protector Cover (78""x72"" Fits Upto 10 Inches - King, Grey",Kitchen
"Pigeon Polypropylene Mini Handy and Compact Chopper with 3 Blades for Effortlessly Chopping Vegetables and Fruits for Your Kitchen (12420, Green, 400 ml)",₹188.00,"260,690",N/A,"Pigeon Polypropylene Mini Handy and Compact Chopper with 3 Blades for Effortlessly Chopping Vegetables and Fruits for Your Kitchen (12420, Green, 400 ml)",Kitchen
"One94Store 36 Feet Long LED Power Pixel Serial String Light, 360 Degree LED Bulb Light Series Copper Led Pixel String Light for Home Diwali, Christmas Decoration (Multicolor, Pack of 1)",₹149.00,"1,149",N/A,"One94Store 36 Feet Long LED Power Pixel Serial String Light, 360 Degree LED Bulb Light Series Copper Led Pixel String Light for Home Diwali, Christmas Decoration (Multicolor, Pack of 1)",Kitchen
"Panasonic 9 Watt Motion Sensor Led B22D Bulb for Home with 3 Mtr Radius Sensor Area,Auto Off After 15 Sec Comes with 30000 Bh Life and 1 Yr Warranty",₹194.00,"5,658",N/A,"Panasonic 9 Watt Motion Sensor Led B22D Bulb for Home with 3 Mtr Radius Sensor Area,Auto Off After 15 Sec Comes with 30000 Bh Life and 1 Yr Warranty",Kitchen
ALOXE Cosmetic Organizer Box Drawers Storage Plastic Stationary Box | Make Up Organiser For Women,₹199.00,"3,764",N/A,ALOXE Cosmetic Organizer Box Drawers Storage Plastic Stationary Box | Make Up Organiser For Women,Kitchen
"Cookwell Bullet Mixer Grinder (5 Jars, 3 Blades, Silver) - Copper, 600 Watts - 2 Year Warranty","₹1,999.00","18,683",N/A,"Cookwell Bullet Mixer Grinder (5 Jars, 3 Blades, Silver) - Copper, 600 Watts - 2 Year Warranty",Kitchen
"GADDA CO Cotton Feel Terry 78x72 inch Ultra Soft Waterproof Mattress Protector King Size | Breathable Hypoallergenic Mattresses Cover for King Size Bed (78x72 inch | 6.5x6 feet, Grey - Pack of 1)",₹627.00,"2,839",N/A,"GADDA CO Cotton Feel Terry 78x72 inch Ultra Soft Waterproof Mattress Protector King Size | Breathable Hypoallergenic Mattresses Cover for King Size Bed (78x72 inch | 6.5x6 feet, Grey - Pack of 1)",Kitchen
Gas Lighter for Kitchen Use | Rechargeable Electric Lighter | Diwali Lighter | Stove & Candle Lighter with USB Charging Port | 1 Year Warranty | 600 Uses in Single Charge,₹298.00,393,N/A,Gas Lighter for Kitchen Use | Rechargeable Electric Lighter | Diwali Lighter | Stove & Candle Lighter with USB Charging Port | 1 Year Warranty | 600 Uses in Single Charge,Kitchen
"Wakefit Height Adjustable Hollow Fiber Sleeping Pillow with Zip |(White and Grey, Standard, Set of 2, Microfiber) 3 Months Warranty",₹879.00,"73,768",N/A,"Wakefit Height Adjustable Hollow Fiber Sleeping Pillow with Zip |(White and Grey, Standard, Set of 2, Microfiber) 3 Months Warranty",Kitchen
SOFTSPUN Microfiber Cloth - 4 pcs - 40x40 cms - 340 GSM Grey! Thick Lint & Streak-Free Multipurpose Cloths - Automotive Microfibre Towels for Car Bike Cleaning Polishing Washing & Detailing.…,₹299.00,"92,403",,SOFTSPUN Microfiber Cloth - 4 pcs - 40x40 cms - 340 GSM Grey! Thick Lint & Streak-Free Multipurpose Cloths - Automotive Microfibre Towels for Car Bike Cleaning Polishing Washing & Detailing.…,Boost
"ALPINO High Protein Super Rolled Oats Chocolate 1kg - Rolled Oats, Natural Peanut Butter & Cocoa Powder – Protein, No Added Sugar & Salt, Gluten Free – As Seen on Shark Tank India",₹489.00,"1,672",N/A,"ALPINO High Protein Super Rolled Oats Chocolate 1kg - Rolled Oats, Natural Peanut Butter & Cocoa Powder – Protein, No Added Sugar & Salt, Gluten Free – As Seen on Shark Tank India",Boost
"Zlade Ballistic LITE PLUS Body Trimmer Men Manscaping, Private Part Shaving, Beard, Pubic Hair Groomer, Waterproof, Rechargeable, Fast Charging, Travel Lock- Color Black","₹1,299.00","5,432",N/A,"Zlade Ballistic LITE PLUS Body Trimmer Men Manscaping, Private Part Shaving, Beard, Pubic Hair Groomer, Waterproof, Rechargeable, Fast Charging, Travel Lock- Color Black",Boost
