name,price,No_of_rating,rating,description,category
(Refurbished) D-Link DIR-825 AC 1200 Wi-Fi Dual-Band Gigabit (LAN/WAN) Router,"₹3,499.00",434,N/A,(Refurbished) D-Link DIR-825 AC 1200 Wi-Fi Dual-Band Gigabit (LAN/WAN) Router,Amazon-renewed
"Certified Refurbished Echo Dot (4th Gen, 2020 release)| Smart speaker with Alexa (Black)","₹2,974.00",142,N/A,"Certified Refurbished Echo Dot (4th Gen, 2020 release)| Smart speaker with Alexa (Black)",Amazon-renewed
(Refurbished) Philips HL7756/00 750-Watt Mixer Grinder with 3 Jars (Black),"₹1,061.00",414,N/A,(Refurbished) Philips HL7756/00 750-Watt Mixer Grinder with 3 Jars (Black),Amazon-renewed
"(Refurbished) Nokia All-New 105 Dual Sim Keypad Phone with Built-in UPI Payments, Long-Lasting Battery, Wireless FM Radio | Charcoal","₹16,900.00",339,N/A,"(Refurbished) Nokia All-New 105 Dual Sim Keypad Phone with Built-in UPI Payments, Long-Lasting Battery, Wireless FM Radio | Charcoal",Amazon-renewed
"(Renewed) DELL Latitude 5490 Core i5 7th Gen Laptop, 8 GB RAM, 256GB SSD, Intel HD Graphics, 14 inch (36.83 cms) HD Screen, Windows 11 (Upgraded), MS Office, Black, Slim",N/A,34,N/A,"(Renewed) DELL Latitude 5490 Core i5 7th Gen Laptop, 8 GB RAM, 256GB SSD, Intel HD Graphics, 14 inch (36.83 cms) HD Screen, Windows 11 (Upgraded), MS Office, Black, Slim",Amazon-renewed
